[
  {
    "id": "c2-2026-w42-1",
    "channel": "c2-reach",
    "week": "2026-W42",
    "slot": 1,
    "theme": "ink",
    "opening": "highlighter-swipe",
    "primitives": [
      "highlighter-swipe",
      "conveyor",
      "split-flap",
      "before-after-split",
      "counter-drop",
      "end-card"
    ],
    "transitions": [
      "cut",
      "ink-wipe",
      "whip-pan",
      "whip-pan",
      "whip-pan",
      "cut"
    ],
    "rhythm": "TBD",
    "hook_pattern": "number",
    "fingerprint": "18a47b1c74b9",
    "experiment": true
  },
  {
    "id": "c2-2026-w42-2",
    "channel": "c2-reach",
    "week": "2026-W42",
    "slot": 2,
    "theme": "ink",
    "opening": "split-flap",
    "primitives": [
      "split-flap",
      "zoom-dive",
      "word-stack-slam",
      "before-after-split",
      "counter-drop",
      "end-card"
    ],
    "transitions": [
      "cut",
      "cut",
      "whip-pan",
      "ink-wipe",
      "ink-wipe",
      "ink-wipe"
    ],
    "rhythm": "TBD",
    "hook_pattern": "should-not",
    "fingerprint": "cd5ac4c18462",
    "experiment": false
  },
  {
    "id": "c2-2026-w42-3",
    "channel": "c2-reach",
    "week": "2026-W42",
    "slot": 3,
    "theme": "studio",
    "opening": "highlighter-swipe",
    "primitives": [
      "highlighter-swipe",
      "counter-drop",
      "word-stack-slam",
      "before-after-split",
      "chat-pop",
      "end-card"
    ],
    "transitions": [
      "cut",
      "cut",
      "cut",
      "cut",
      "cut",
      "whip-pan"
    ],
    "rhythm": "TBD",
    "hook_pattern": "number",
    "fingerprint": "37f7d3d3a567",
    "experiment": false
  },
  {
    "id": "c2-2026-w42-4",
    "channel": "c2-reach",
    "week": "2026-W42",
    "slot": 4,
    "theme": "studio",
    "opening": "counter-drop",
    "primitives": [
      "counter-drop",
      "chat-pop",
      "split-flap",
      "maze-to-line",
      "word-stack-slam",
      "end-card"
    ],
    "transitions": [
      "cut",
      "ink-wipe",
      "ink-wipe",
      "whip-pan",
      "cut",
      "whip-pan"
    ],
    "rhythm": "TBD",
    "hook_pattern": "before-after",
    "fingerprint": "c47d4ca20f2e",
    "experiment": false
  },
  {
    "id": "c2-2026-w42-5",
    "channel": "c2-reach",
    "week": "2026-W42",
    "slot": 5,
    "theme": "mono",
    "opening": "phone-buzz",
    "primitives": [
      "phone-buzz",
      "counter-drop",
      "highlighter-swipe",
      "conveyor",
      "word-stack-slam",
      "end-card"
    ],
    "transitions": [
      "cut",
      "cut",
      "ink-wipe",
      "whip-pan",
      "cut",
      "whip-pan"
    ],
    "rhythm": "TBD",
    "hook_pattern": "confession",
    "fingerprint": "cfe910a096d0",
    "experiment": false
  },
  {
    "id": "c2-2026-w42-6",
    "channel": "c2-reach",
    "week": "2026-W42",
    "slot": 6,
    "theme": "mono",
    "opening": "zoom-dive",
    "primitives": [
      "zoom-dive",
      "chat-pop",
      "highlighter-swipe",
      "before-after-split",
      "split-flap",
      "end-card"
    ],
    "transitions": [
      "cut",
      "whip-pan",
      "ink-wipe",
      "whip-pan",
      "ink-wipe",
      "cut"
    ],
    "rhythm": "TBD",
    "hook_pattern": "before-after",
    "fingerprint": "2468e9c510e6",
    "experiment": false
  },
  {
    "id": "c2-2026-w42-7",
    "channel": "c2-reach",
    "week": "2026-W42",
    "slot": 7,
    "theme": "studio",
    "opening": "counter-drop",
    "primitives": [
      "counter-drop",
      "zoom-dive",
      "split-flap",
      "before-after-split",
      "word-stack-slam",
      "end-card"
    ],
    "transitions": [
      "cut",
      "cut",
      "ink-wipe",
      "ink-wipe",
      "ink-wipe",
      "cut"
    ],
    "rhythm": "TBD",
    "hook_pattern": "number",
    "fingerprint": "5165a917beaa",
    "experiment": true
  }
]
